{
  "schemaVersion": "apollo.component-contract.v2-experimental",
  "documentType": "component-contract",
  "status": "experimental",
  "runtimePolicy": {
    "consumedByApollo": false,
    "publishedToRuntimeIndexes": false,
    "purpose": "Cross-component RuleIR capability discovery"
  },
  "package": {
    "id": "web-corp.card-image",
    "family": "CardImage",
    "library": "Web _ Corp Components",
    "sourcePath": "JSONS/web/components/web-corp/CardImage",
    "sourceGeneratedAt": "2026-07-27T12:58:40.628Z",
    "sourceExportVersion": "0.1.0-rest",
    "sourceFiles": [
      {
        "file": "JSONS/web/components/web-corp/CardImage/README.md",
        "bytes": 5616,
        "sha256": "ac3f2c9a1b7af5ece660b09d960abf89be72dee10d9aab7631eb8422f32956d5"
      },
      {
        "file": "JSONS/web/components/web-corp/CardImage/agent-context.json",
        "bytes": 15230,
        "sha256": "6d7d46e32f266709ad766a408d4f78819602d37a0604108f3f88e76d21439021"
      },
      {
        "file": "JSONS/web/components/web-corp/CardImage/audit-mapping.json",
        "bytes": 10728,
        "sha256": "192ed0aae41bcf92dc3cb8cad3aef1f2c34da2909c95524136a2e9e8dfdc7be5"
      },
      {
        "file": "JSONS/web/components/web-corp/CardImage/composition-contract.json",
        "bytes": 11919,
        "sha256": "62e237a017a5a7f4b198a77a8a8e9afa22c0621232094430380ffbc75d3cc818"
      },
      {
        "file": "JSONS/web/components/web-corp/CardImage/contract.generated.json",
        "bytes": 1292568,
        "sha256": "f464f466f7f8febd9ad714d7d6245f13b2a91d942467858a494311d09746ef48"
      },
      {
        "file": "JSONS/web/components/web-corp/CardImage/contract.overrides.json",
        "bytes": 11888,
        "sha256": "6b7fbb87b1ab0b9a95204671ac08129bc8ed4e47deec2554896f70e397a52ebb"
      },
      {
        "file": "JSONS/web/components/web-corp/CardImage/examples.json",
        "bytes": 9535,
        "sha256": "758b0f27f9beb972a724a4a1f35059b9c21278a367a7f2b7138c19a3fe3dbda3"
      },
      {
        "file": "JSONS/web/components/web-corp/CardImage/rules.json",
        "bytes": 17689,
        "sha256": "62e4cdafc3ae5b53ff3256d015ec1ea9bdf6ed2cf512a120f7e48b926943b1ed"
      }
    ]
  },
  "capabilities": {
    "selectorVersion": 2,
    "factModelVersion": 1,
    "ruleIrVersion": 2,
    "selectors": [
      "component-identity",
      "self-and-descendants"
    ],
    "facts": [
      "baseline.effective",
      "component-api.contract",
      "component.identity",
      "layout.properties",
      "opacity",
      "ownership.owner",
      "paint.fill",
      "paint.stroke",
      "style.text",
      "target.componentKey",
      "target.variant.properties",
      "text.characters",
      "variable.binding",
      "variant.properties"
    ],
    "operators": [
      "classificationPolicy",
      "componentApiValid",
      "matchesEffectiveBaseline"
    ],
    "remediations": [
      "set-variant-properties"
    ],
    "unknownCapabilityPolicy": "unsupported-fail-closed",
    "missingEvidencePolicy": "unknown-never-violation"
  },
  "facts": {
    "componentApi": [
      {
        "id": "card-item.universal",
        "name": "🔩 CardItem",
        "componentKey": "801c15ba3f3cdd87b5fa7bc089cc48379aa37972",
        "componentKeys": [
          "120e55b005e2805006dcad92fa0c712f46274526",
          "801c15ba3f3cdd87b5fa7bc089cc48379aa37972",
          "b5b668c439cc8dd0eb012324819806f79b3b16b3",
          "cd93abe00c60009bfcfc12516409a40b489eb3e8",
          "e71d93b680cb4b3314e43adf22415ef7a8ec837e",
          "ea72647c0dd4e4d88f3eeff073b621ba89ac183d"
        ],
        "platform": "universal",
        "status": "active",
        "publicApi": {
          "properties": {
            "Size": [
              "212x132",
              "24x16",
              "264x164",
              "44x28",
              "68x42"
            ]
          },
          "allowedCombinations": [
            {
              "Size": "264x164"
            },
            {
              "Size": "212x132"
            },
            {
              "Size": "68x42"
            },
            {
              "Size": "44x28"
            },
            {
              "Size": "24x16"
            }
          ]
        },
        "evidence": {
          "source": "JSONS/web/components/web-corp/CardImage/contract.generated.json",
          "anatomyCount": 4,
          "structureNodeCount": 22
        }
      },
      {
        "id": "cover.universal",
        "name": "🔩 Cover",
        "componentKey": "2254a4b0565c2acbe8c7fbca11a55b4c92fc5232",
        "componentKeys": [
          "17f96f039bf80e17c49df4b944777613679d954e",
          "2254a4b0565c2acbe8c7fbca11a55b4c92fc5232",
          "2a02bc513486ebced9152bb6e1b6a352326c8a05",
          "2d2dbffe2dd2c9580a22377b7afeaf03fae7f6ae",
          "3930ffddd174cbd8f2cdf8e3c11e83fcb74ada3d",
          "466827bd1516496e32384287a32fc38db712b3fd",
          "65393d7cb60997b3eb09e911fbe9bdfb092bf014",
          "759a909aae5b72846d7a0263e4ba8b8c73880b6f",
          "78263437591c4c208388df0c82e8779bcde7924d",
          "8374412d6e838af5b5ff5394300043ac736b2af1",
          "97908d8d820345aa32c1fd2638427a1a8fadece3",
          "9ef05e3f4c3e5d15790a5d8ac8f83bb1e02b9821",
          "baac09d01bab6203d10248abf43bd27612976c84",
          "be71def62672a34e442f7b4c9aa3e644acf1b679",
          "cd9cff1645469189e934206dd8bd2c44dadf85ec",
          "da5d68abd878db60d5f18a589c2deeadde16027b",
          "dd6bdaa62b4f8634ebc4d6d8871f979e650a2f9f",
          "eb671821781048c305163c0a77194a31da89b2fd",
          "eb89159d0720596412147f2b8d58a0f3cfb2f31e",
          "fdbb5cbffacafb0276da5abb3b6f0adfca47a443",
          "ffc2c365717a21f9ef544613718f08167c08151b"
        ],
        "platform": "universal",
        "status": "active",
        "publicApi": {
          "properties": {
            "Product Type": [
              "AB",
              "AB Credit",
              "AB Premium",
              "Archive"
            ],
            "Size": [
              "212x132",
              "24x16",
              "264x164",
              "44x28",
              "68x42"
            ]
          },
          "allowedCombinations": [
            {
              "Product Type": "Archive",
              "Size": "24x16"
            },
            {
              "Product Type": "Archive",
              "Size": "44x28"
            },
            {
              "Product Type": "Archive",
              "Size": "68x42"
            },
            {
              "Product Type": "Archive",
              "Size": "212x132"
            },
            {
              "Product Type": "Archive",
              "Size": "264x164"
            },
            {
              "Product Type": "AB",
              "Size": "264x164"
            },
            {
              "Product Type": "AB Credit",
              "Size": "264x164"
            },
            {
              "Product Type": "AB Premium",
              "Size": "264x164"
            },
            {
              "Product Type": "AB",
              "Size": "212x132"
            },
            {
              "Product Type": "AB Credit",
              "Size": "212x132"
            },
            {
              "Product Type": "AB Premium",
              "Size": "212x132"
            },
            {
              "Product Type": "AB",
              "Size": "68x42"
            },
            {
              "Product Type": "AB Credit",
              "Size": "68x42"
            },
            {
              "Product Type": "AB Premium",
              "Size": "68x42"
            },
            {
              "Product Type": "AB",
              "Size": "44x28"
            },
            {
              "Product Type": "AB Credit",
              "Size": "44x28"
            },
            {
              "Product Type": "AB Premium",
              "Size": "44x28"
            },
            {
              "Product Type": "AB",
              "Size": "24x16"
            },
            {
              "Product Type": "AB Credit",
              "Size": "24x16"
            },
            {
              "Product Type": "AB Premium",
              "Size": "24x16"
            }
          ]
        },
        "evidence": {
          "source": "JSONS/web/components/web-corp/CardImage/contract.generated.json",
          "anatomyCount": 1,
          "structureNodeCount": 7
        }
      },
      {
        "id": "shadow.universal",
        "name": "🔩 Shadow",
        "componentKey": "e0f79b3378bd428cea895ce4124199edf5509f93",
        "componentKeys": [
          "3823dc6fa76439527c35fe053d1cbcc246bac827",
          "4fbf55d7ec437fa9d2bb1e901445439e2b4c3aa7",
          "9c9b7c469df57de530aa39950ac03e6437fa9775",
          "b49a16b8718d232fb64fa7bd18d76e56abe1d0eb",
          "e0f79b3378bd428cea895ce4124199edf5509f93"
        ],
        "platform": "universal",
        "status": "active",
        "publicApi": {
          "properties": {
            "Size": [
              "212x132",
              "264x164",
              "44x28",
              "68x42"
            ]
          },
          "allowedCombinations": [
            {
              "Size": "264x164"
            },
            {
              "Size": "212x132"
            },
            {
              "Size": "68x42"
            },
            {
              "Size": "44x28"
            }
          ]
        },
        "evidence": {
          "source": "JSONS/web/components/web-corp/CardImage/contract.generated.json",
          "anatomyCount": 1,
          "structureNodeCount": 1
        }
      },
      {
        "id": "silver-line.universal",
        "name": "🔩 SilverLine",
        "componentKey": "3fd06cdd38d50a431893a8d2ce9d25f75149a3ac",
        "componentKeys": [
          "3fd06cdd38d50a431893a8d2ce9d25f75149a3ac",
          "8615390fc2acbc1e94dc866b12fc2d49ae69e64a",
          "b822a4df9fee56a50bae59c49b8890af962f2595"
        ],
        "platform": "universal",